{
  "version": "0.1.1",
  "orchestrator": "orchestrator",
  "agents": [
    "adapter-drift-auditor",
    "adoption-architect",
    "ai-engineer",
    "analytics-engineer",
    "audit-bundle-reviewer",
    "automation-engineer",
    "backend-engineer",
    "beta-release-coordinator",
    "change-provenance-engineer",
    "checkpoint-integrity-reviewer",
    "cloud-architect",
    "codex-runtime-engineer",
    "compatibility-engineer",
    "compliance-analyst",
    "conflict-resolution-engineer",
    "content-designer",
    "context-pack-engineer",
    "contract-test-engineer",
    "data-engineer",
    "dependency-manager",
    "deprecation-manager",
    "design-system-engineer",
    "developer-experience-engineer",
    "devops-engineer",
    "documentation-architect",
    "documentation-engineer",
    "enterprise-architect",
    "evidence-ledger-architect",
    "execution-continuity-engineer",
    "experimentation-analyst",
    "finops-engineer",
    "frontend-engineer",
    "generative-engine-optimization-strategist",
    "governance-steward",
    "integration-engineer",
    "knowledge-contradiction-reviewer",
    "knowledge-engineer",
    "localization-engineer",
    "manual-deployment-auditor",
    "manual-deployment-safety-engineer",
    "memory-governance-architect",
    "merge-readiness-reviewer",
    "migration-architect",
    "mobile-engineer",
    "monorepo-maintainer",
    "parallel-execution-architect",
    "patch-integrity-engineer",
    "performance-engineer",
    "platform-engineer",
    "policy-enforcement-architect",
    "policy-engineer",
    "policy-exception-reviewer",
    "privacy-engineer",
    "product-architect",
    "product-manager",
    "project-health-analyst",
    "project-memory-curator",
    "project-state-reconciler",
    "qa-engineer",
    "reference-implementation-reviewer",
    "release-integrity-engineer",
    "release-manager",
    "reliability-engineer",
    "resume-packet-reviewer",
    "runtime-adapter-engineer",
    "runtime-capability-mapper",
    "runtime-catalog-maintainer",
    "runtime-conformance-auditor",
    "runtime-execution-planner",
    "runtime-handoff-coordinator",
    "runtime-parity-reviewer",
    "runtime-synchronization-engineer",
    "search-retrieval-engineer",
    "security-engineer",
    "session-continuity-engineer",
    "solution-blueprint-engineer",
    "stability-engineer",
    "support-policy-maintainer",
    "task-routing-engineer",
    "technical-auditor",
    "technical-debt-steward",
    "technical-program-manager",
    "test-automation-engineer",
    "threat-modeling-engineer",
    "universal-runtime-architect",
    "ux-director",
    "workstream-coordinator"
  ],
  "contracts": [
    "agent-contract",
    "memory-contract",
    "workflow-contract",
    "skill-contract",
    "review-contract",
    "command-contract"
  ],
  "workflows": [
    "adapter-drift-audit",
    "ai-feature-delivery",
    "analytics-implementation",
    "architecture-portfolio",
    "audit-bundle",
    "beta-release-preparation",
    "beta-stabilization",
    "blueprint-instantiation",
    "bug-fix",
    "capability-quality-assessment",
    "ci-governance",
    "codex-synchronization",
    "compatibility-validation",
    "context-pack",
    "continuation-planning",
    "continuity-refresh",
    "contract-testing",
    "cross-session-recovery",
    "database-migration",
    "debt-reduction",
    "decision-governance",
    "default",
    "dependency-upgrade",
    "deprecation-lifecycle",
    "design-system-contribution",
    "documentation-consolidation",
    "dual-runtime-release",
    "evidence-capture",
    "experiment-rollout",
    "feature-delivery",
    "finops-optimization",
    "framework-adoption",
    "framework-upgrade",
    "frontend-feature-delivery",
    "generative-engine-optimization-delivery",
    "incident-response",
    "integration-onboarding",
    "interrupted-task-recovery",
    "knowledge-synchronization",
    "localization-delivery",
    "manual-deployment-audit",
    "manual-deployment-preflight",
    "memory-drift-audit",
    "mobile-feature",
    "monorepo-change",
    "package-validation",
    "parallel-execution",
    "policy-evaluation",
    "policy-exception",
    "privacy-review",
    "product-discovery",
    "production-product-quality-readiness",
    "project-bootstrap",
    "project-health",
    "project-state-reconciliation",
    "provenance-reconciliation",
    "refactoring",
    "reference-build-benchmark",
    "reference-project-review",
    "release",
    "release-artifact",
    "release-governance",
    "runtime-adapter",
    "runtime-catalog-publication",
    "runtime-conformance",
    "runtime-execution",
    "runtime-handoff",
    "runtime-parity",
    "runtime-synchronization",
    "saas-from-brief-delivery",
    "saas-production-readiness",
    "session-bootstrap",
    "session-closeout",
    "shared-state-protection",
    "site-from-brief-delivery",
    "support-policy",
    "system-modernization",
    "task-envelope-lifecycle",
    "task-routing",
    "technical-audit",
    "technical-program",
    "test-automation",
    "threat-modeling",
    "web-production-assurance",
    "web-security-edge-assurance",
    "workstream-merge"
  ],
  "skills": [
    "accessibility-audit",
    "adapter-drift-detection",
    "admin-operations-surface",
    "adr-authoring",
    "agent-overlap-analysis",
    "ai-search-measurement",
    "ai-system-design",
    "analytics-implementation-audit",
    "api-contract-analysis",
    "application-search-design",
    "architecture-assessment",
    "architecture-audit",
    "architecture-portfolio-assessment",
    "audit-bundle-assembly",
    "audit-log-design",
    "authentication-flow-review",
    "authorization-boundary-review",
    "background-job-reliability",
    "blueprint-selection",
    "browser-flow-validation",
    "cache-strategy-assessment",
    "change-provenance-mapping",
    "cloud-cost-analysis",
    "cms-content-modeling",
    "codex-runtime-generation",
    "command-catalog-synthesis",
    "compatibility-matrix-analysis",
    "compliance-evidence-mapping",
    "component-reuse-assessment",
    "conflict-prediction",
    "content-discoverability-review",
    "content-quality-review",
    "context-pack-composition",
    "continuation-planning",
    "continuity-reconciliation",
    "control-design",
    "conversion-funnel-review",
    "core-contract-stabilization",
    "crawler-edge-access-audit",
    "data-import-export-workflow",
    "database-migration-analysis",
    "database-schema-review",
    "dependency-graph-analysis",
    "dependency-impact-analysis",
    "deprecation-planning",
    "design-token-architecture",
    "developer-onboarding-assessment",
    "documentation-information-architecture",
    "dual-runtime-validation",
    "entity-authority-mapping",
    "event-taxonomy-design",
    "evidence-record-design",
    "execution-checkpointing",
    "experiment-design",
    "external-api-resilience-review",
    "feature-flag-rollout",
    "file-upload-storage-design",
    "form-mutation-design",
    "framework-package-validation",
    "frontend-craft-review",
    "frontend-stack-selection",
    "generative-engine-optimization",
    "immersive-3d-experience",
    "incident-triage",
    "incremental-patch-verification",
    "infrastructure-change-assessment",
    "integration-contract-mapping",
    "interface-visual-direction",
    "knowledge-graph-synthesis",
    "localization-readiness-assessment",
    "manual-deployment-preflight",
    "manual-deployment-receipt",
    "memory-drift-analysis",
    "memory-freshness-audit",
    "memory-update-proposal",
    "mobile-architecture-assessment",
    "motion-choreography",
    "notification-system-design",
    "observability-design",
    "payment-integration-review",
    "performance-budget-analysis",
    "policy-as-code-design",
    "policy-exception-handling",
    "policy-rule-design",
    "privacy-impact-assessment",
    "product-requirement-decomposition",
    "project-adoption-assessment",
    "project-brief-synthesis",
    "project-health-assessment",
    "prompt-model-evaluation",
    "rag-architecture-assessment",
    "rate-limit-abuse-control",
    "reference-implementation-review",
    "registry-to-runtime-generation",
    "regression-risk-analysis",
    "release-integrity-verification",
    "repository-mapping",
    "resource-claim-design",
    "responsive-layout-audit",
    "result-reconciliation",
    "resume-packet-assembly",
    "row-level-security-review",
    "runtime-adapter-mapping",
    "runtime-conformance-testing",
    "runtime-execution-planning",
    "runtime-handoff-design",
    "runtime-semantic-parity",
    "saas-multitenancy-review",
    "secret-environment-audit",
    "semantic-compatibility-verification",
    "seo-technical-audit",
    "session-closeout",
    "skill-quality-evaluation",
    "skill-trigger-evaluation",
    "smoke-test-design",
    "source-of-truth-validation",
    "structured-data-validation",
    "supply-chain-risk-audit",
    "support-classification",
    "task-routing-policy",
    "technical-debt-classification",
    "technical-roadmap-synthesis",
    "test-strategy-design",
    "threat-modeling",
    "transactional-email-delivery",
    "universal-runtime-contract-design",
    "version-migration-planning",
    "version-transition-validation",
    "visual-regression-review",
    "web-performance-field-readiness",
    "web-security-header-audit",
    "webhook-reliability-review",
    "workstream-decomposition"
  ],
  "reviews": [
    "adapter-drift-review",
    "adoption-review",
    "ai-system-review",
    "analytics-review",
    "architecture-review",
    "automation-review",
    "beta-readiness-review",
    "blueprint-review",
    "capability-quality-review",
    "checkpoint-integrity-review",
    "codex-runtime-review",
    "compatibility-review",
    "compliance-review",
    "content-review",
    "context-assembly-review",
    "context-pack-review",